{
  "slug": "ipip-ipc-v1",
  "name": "IPIP-IPC",
  "category": "behavioral",
  "scoring_method": "likert_sum",
  "version": "v1",
  "status": "active",
  "is_active": true,
  "intended_use": "hr_assessment",
  "report_family": "individual",
  "description": "Canonical Deep Profile v1 IPIP-IPC assessment package. English/IPIP structure is canonical. B/H/S wording is operational app localization v1 and is not a formally standardized B/H/S psychometric form."
}
